{
  "name": "NVNM Chain Devnet",
  "chain": "NVNM",
  "rpc": [
    "https://rpc.nvnm.canary.mantrachain.dev",
    "wss://rpc.nvnm.canary.mantrachain.dev"
  ],
  "faucets": ["https://faucet.nvnm.canary.mantrachain.dev"],
  "nativeCurrency": {
    "name": "NVNM USD",
    "symbol": "nUSD",
    "decimals": 6
  },
  "infoURL": "https://www.nvnmchain.io",
  "shortName": "nvnm-chain-devnet",
  "chainId": 787222,
  "networkId": 787222,
  "icon": "nvnm",
  "explorers": [
    {
      "name": "NVNM Explorer",
      "url": "https://explorer.nvnm.canary.mantrachain.dev",
      "icon": "nvnm",
      "standard": "EIP3091"
    },
    {
      "name": "NVNM Tempo Explorer",
      "url": "https://scan.nvnm.canary.mantrachain.dev",
      "icon": "nvnm",
      "standard": "EIP3091"
    }
  ]
}
