{
  "name": "Settlus",
  "chain": "ETH",
  "rpc": ["https://settlus-mainnet.g.alchemy.com/public"],
  "faucets": [],
  "nativeCurrency": {
    "name": "Ether",
    "symbol": "ETH",
    "decimals": 18
  },
  "infoURL": "https://settlus.org",
  "shortName": "setl",
  "chainId": 5371,
  "networkId": 5371,
  "parent": {
    "type": "L2",
    "chain": "eip155-1",
    "bridges": [{ "url": "https://settlus-mainnet.bridge.alchemy.com/" }]
  },
  "explorers": [
    {
      "name": "Settlus Mainnet Explorer",
      "url": "https://mainnet.settlus.network",
      "standard": "EIP3091"
    }
  ],
  "status": "active"
}
