{
  "name": "Paribu Net Testnet",
  "chain": "PRB",
  "rpc": ["https://rpc.testnet.paribuscan.com"],
  "faucets": ["https://faucet.paribuscan.com"],
  "nativeCurrency": {
    "name": "PRB",
    "symbol": "PRB",
    "decimals": 18
  },
  "infoURL": "https://net.paribu.com",
  "shortName": "prbtestnet",
  "chainId": 3500,
  "networkId": 3500,
  "slip44": 1,
  "icon": "prb",
  "explorers": [
    {
      "name": "Paribu Net Testnet Explorer",
      "url": "https://testnet.paribuscan.com",
      "standard": "EIP3091"
    }
  ]
}
