{
  "name": "Mersennet",
  "title": "Mersennet Mainnet",
  "chain": "MRSN",
  "rpc": [],
  "faucets": [],
  "nativeCurrency": {
    "name": "Mersennet",
    "symbol": "MRSN",
    "decimals": 18
  },
  "infoURL": "https://mersennet.com",
  "shortName": "mrsn",
  "chainId": 8191,
  "networkId": 8191,
  "status": "incubating"
}
