{
  "name": "BlockX Atlantis Testnet",
  "chain": "blockx",
  "rpc": ["https://atlantis-rpc.blockxnet.com/"],
  "faucets": ["https://ping.blockxnet.com/blockx-atlantis-testnet/faucet"],
  "nativeCurrency": {
    "name": "BCX",
    "symbol": "BCX",
    "decimals": 18
  },
  "features": [{ "name": "EIP155" }, { "name": "EIP1559" }],
  "infoURL": "https://www.blockxnet.com/",
  "shortName": "bcx",
  "chainId": 19077,
  "networkId": 19077,
  "explorers": [
    {
      "name": "BlockX EVM Explorer (Blockscout)",
      "url": "https://testnet-explorer.blockxnet.com/",
      "standard": "EIP3091"
    },
    {
      "name": "BlockX Cosmos Explorer (Ping)",
      "url": "https://ping.blockxnet.com/blockx-atlantis-testnet",
      "standard": "none"
    }
  ]
}
