{
  "name": "ZCore Testnet",
  "chain": "Beach",
  "icon": "zcore",
  "rpc": ["https://rpc-testnet.zcore.cash"],
  "faucets": ["https://faucet.zcore.cash"],
  "nativeCurrency": {
    "name": "ZCore",
    "symbol": "ZCR",
    "decimals": 18
  },
  "infoURL": "https://zcore.cash",
  "shortName": "zcrbeach",
  "chainId": 3331,
  "networkId": 3331
}
