{
  "name": "ERAM Mainnet",
  "chain": "ERAM",
  "icon": "eram",
  "rpc": ["https://mainnet-rpc.eramscan.com"],
  "faucets": [],
  "nativeCurrency": {
    "name": "ERAM",
    "symbol": "ERAM",
    "decimals": 18
  },
  "infoURL": "http://doc.eramscan.com/",
  "shortName": "ERAM",
  "chainId": 721529,
  "networkId": 721529,
  "explorers": [
    {
      "name": "Eramscan",
      "url": "https://eramscan.com",
      "standard": "EIP3091"
    }
  ]
}
