{
  "name": "Callisto Testnet Deprecated",
  "chain": "CLO",
  "rpc": [],
  "faucets": [],
  "nativeCurrency": {
    "name": "Callisto Testnet Ether",
    "symbol": "TCLO",
    "decimals": 18
  },
  "infoURL": "https://callisto.network",
  "shortName": "tclo",
  "chainId": 821,
  "networkId": 2,
  "slip44": 1,
  "status": "deprecated"
}
