{
  "name": "Bitgert Mainnet",
  "chain": "Brise",
  "rpc": [
    "https://rpc-bitgert.icecreamswap.com",
    "https://mainnet-rpc.brisescan.com",
    "https://chainrpc.com",
    "https://serverrpc.com"
  ],
  "faucets": [],
  "nativeCurrency": {
    "name": "Bitrise Token",
    "symbol": "Brise",
    "decimals": 18
  },
  "infoURL": "https://bitgert.com/",
  "shortName": "Brise",
  "chainId": 32520,
  "networkId": 32520,
  "icon": "brise",
  "explorers": [
    {
      "name": "Brise Scan",
      "url": "https://brisescan.com",
      "icon": "brise",
      "standard": "EIP3091"
    }
  ]
}
