{
  "name": "TSx Testnet",
  "chain": "AVAX",
  "icon": "avax",
  "rpc": ["https://subnets.avax.network/tsx-testnet/mainnet/rpc"],
  "faucets": [],
  "nativeCurrency": {
    "name": "Avalanche",
    "symbol": "AVAX",
    "decimals": 18
  },
  "features": [{ "name": "EIP1559" }],
  "infoURL": "https://github.com/VenomekPL/TSx-Network",
  "shortName": "tsx-testnet",
  "chainId": 454,
  "networkId": 454,
  "status": "incubating",
  "explorers": [
    {
      "name": "Avalanche Subnet Explorer",
      "url": "https://subnets.avax.network/tsx-testnet",
      "standard": "EIP3091"
    }
  ]
}
