{
  "name": "Theta Amber Testnet",
  "chain": "Theta",
  "rpc": ["https://eth-rpc-api-amber.thetatoken.org/rpc"],
  "faucets": [],
  "nativeCurrency": {
    "name": "Theta Fuel",
    "symbol": "TFUEL",
    "decimals": 18
  },
  "infoURL": "https://www.thetatoken.org/",
  "shortName": "theta-amber",
  "chainId": 364,
  "networkId": 364,
  "slip44": 1,
  "explorers": [
    {
      "name": "Theta Amber Testnet Explorer",
      "url": "https://guardian-testnet-amber-explorer.thetatoken.org",
      "standard": "EIP3091"
    }
  ]
}
