{
  "name": "Fidesinnova",
  "chain": "Fidesinnova",
  "rpc": ["https://rpc1.fidesinnova.io"],
  "faucets": [],
  "nativeCurrency": {
    "name": "Fidesinnova",
    "symbol": "FDS",
    "decimals": 18
  },
  "infoURL": "https://fidesinnova.gitbook.io/docs",
  "shortName": "Fidesinnova",
  "chainId": 706883,
  "networkId": 706883,
  "explorers": [
    {
      "name": "Fidesinnova Blockchain Explorer",
      "url": "https://explorer.fidesinnova.io",
      "standard": "none"
    }
  ]
}
