{
  "name": "Ultra EVM Network Testnet",
  "chain": "Ultra",
  "icon": "ultra",
  "rpc": ["https://evm.test.ultra.eosusa.io"],
  "faucets": [],
  "nativeCurrency": {
    "name": "Ultra Token",
    "symbol": "UOS",
    "decimals": 18
  },
  "infoURL": "https://ultra.io/",
  "shortName": "ultra-testnet",
  "chainId": 18881,
  "networkId": 18881,
  "slip44": 1,
  "explorers": [
    {
      "name": "Ultra EVM Testnet Explorer",
      "url": "https://evmexplorer.testnet.ultra.io",
      "standard": "EIP3091"
    }
  ]
}
